{
    "categories": [],
    "created_at": "2020-01-05 13:42:26.766831",
    "icon_url": "https://assets.chucknorris.host/img/avatar/chuck-norris.png",
    "id": "24v13bMAQ7-eEs-1TMw9Aw",
    "updated_at": "2020-01-05 13:42:26.766831",
    "url": "https://api.chucknorris.io/jokes/24v13bMAQ7-eEs-1TMw9Aw",
    "value": "Chuck Norris once milked a honey badger."
}